{
  "schema_version": "p2a.task_graph.v1",
  "projectId": "p2a-local-artifact-store",
  "version": "2026-06-27-gate-c-split-oversized-tasks",
  "sourceSpec": "../gate-b-spec/spec.json",
  "tasks": [
    {
      "id": "task-1",
      "title": "Bootstrap Kotlin Spring Boot service",
      "description": "Create the Kotlin Spring Boot project skeleton, build configuration, package layout, application config, and local Docker Compose baseline for a single REST service.",
      "status": "done",
      "dependencies": [],
      "acceptanceCriteria": [
        "Gradle Kotlin DSL project is present with build.gradle.kts, settings.gradle.kts, Spring Boot Gradle plugin 4.1.0, Spring WebMVC, Validation, JDBC, Actuator, Flyway, PostgreSQL JDBC driver, and Testcontainers dependencies.",
        "Java toolchain and runtime baseline are configured for Java 25 LTS, and Gradle uses 9.1.0 or later 9.x.",
        "Dependency versions use Spring Boot managed versions/BOM by default, with direct version pins only for Gradle/Kotlin plugins, Docker image tags, libraries outside the Spring Boot BOM, or required security patches.",
        "Application entrypoint and package skeleton exist for domain, application ports/use cases, REST adapters, PostgreSQL/search adapters, security adapter, and config.",
        "Local config includes database connection settings and a configurable local token/API key without committing secrets.",
        "Docker Compose defines PostgreSQL with pgvector for local development.",
        "No server-rendered UI, static frontend bundle, or separate browser UI scaffold is added.",
        "Spring WebFlux, R2DBC, Spring Data R2DBC, JPA/Hibernate, Spring Security, and OAuth security dependencies are not added for MVP."
      ],
      "targetArea": "project bootstrap",
      "suggestedAgentPrompt": "Bootstrap the Kotlin Spring Boot service described by the approved spec. Add the Gradle project, package layout, application entrypoint, local configuration, and Docker Compose pgvector baseline. Keep the application core independent from Spring MVC/JDBC implementation details.",
      "sourceSpecRefs": [
        "implementation.dependencies",
        "implementation.architecture",
        "product.constraints"
      ]
    },
    {
      "id": "task-2",
      "title": "Define domain model and application ports",
      "description": "Define domain value objects, command/result types, inbound use case interfaces, and outbound port contracts for artifact storage, search, and deduplication.",
      "status": "todo",
      "dependencies": [
        "task-1"
      ],
      "acceptanceCriteria": [
        "Domain model covers projects, iterations, documents, task graphs, tasks, runs, document chunks, artifact types, content hashes, embeddings, canonical server IDs, and source references.",
        "Inbound ports exist for all approved use cases without depending on REST DTOs or Spring MVC.",
        "Outbound ports separate storage, artifact querying, keyword search, vector search, and content hash deduplication.",
        "Core packages do not import PostgreSQL, pgvector SQL, JDBC, or REST adapter classes."
      ],
      "targetArea": "application core",
      "suggestedAgentPrompt": "Implement the domain and application port layer for the local artifact store. Model the approved entities and use case contracts, keeping the application core independent from adapters and framework DTOs.",
      "sourceSpecRefs": [
        "product.data_model_draft",
        "implementation.architecture",
        "implementation.interfaces"
      ]
    },
    {
      "id": "task-3",
      "title": "Add PostgreSQL and pgvector migrations",
      "description": "Create Flyway migrations for pgvector extension, relational tables, JSONB columns, idempotency constraints, and baseline indexes.",
      "status": "todo",
      "dependencies": [
        "task-1",
        "task-2"
      ],
      "acceptanceCriteria": [
        "First migration creates the vector extension with CREATE EXTENSION IF NOT EXISTS vector.",
        "Tables exist for projects, iterations, documents, task_graphs, tasks, runs, document_chunks, embedding_sets, and chunk_embeddings with canonical server IDs and required relationship keys.",
        "Unique constraints support source reference resolution, project/iteration upsert, logical document snapshot idempotency, task graph hash idempotency, task upsert, run upsert, chunkHash idempotency, embedding set uniqueness, and chunkId + embeddingSetId uniqueness.",
        "Schema preserves snapshotVersion history for changed contentHash and keeps document_chunks separate from embedding_sets and chunk_embeddings.",
        "embedding_sets stores embeddingModel, embeddingDimension, embeddingVersion, distanceMetric, and storageType; chunk_embeddings stores the pgvector value and optional embeddingHash.",
        "Baseline indexes support artifact filters, keyword search, and exact vector search without requiring ANN indexes in MVP."
      ],
      "targetArea": "database schema",
      "suggestedAgentPrompt": "Add Flyway migrations for the approved PostgreSQL/pgvector schema. Include relationship tables, JSONB metadata, content hash idempotency, snapshot versioning, keyword search support, embedding_sets, and chunk_embeddings for exact vector search.",
      "sourceSpecRefs": [
        "product.data_model_draft",
        "implementation.architecture",
        "implementation.edge_cases"
      ]
    },
    {
      "id": "task-4",
      "title": "Implement project, iteration, document, and task graph adapters",
      "description": "Implement PostgreSQL outbound adapters for project and iteration upsert, document snapshot storage, task graph storage, and task bulk upsert.",
      "status": "todo",
      "dependencies": [
        "task-2",
        "task-3"
      ],
      "acceptanceCriteria": [
        "Adapters implement ProjectStorePort, IterationStorePort, DocumentSnapshotStorePort, TaskGraphStorePort, and TaskStorePort.",
        "Document snapshot adapter returns an existing snapshot for the same logical artifact and contentHash.",
        "Document snapshot adapter creates the next snapshotVersion when the same sourcePath and artifactType has a different contentHash.",
        "Task graph and task adapters preserve graph JSON, dependencies, acceptance criteria, metadata, and source-to-canonical ID mappings.",
        "Adapters keep SQL and JDBC concerns inside adapter/out/postgres."
      ],
      "targetArea": "postgres adapter",
      "suggestedAgentPrompt": "Implement the PostgreSQL storage adapters for projects, iterations, document snapshots, task graphs, and tasks. Use explicit SQL through the repo's chosen JDBC abstraction and preserve idempotent sync behavior.",
      "sourceSpecRefs": [
        "implementation.architecture",
        "implementation.data_flow",
        "implementation.edge_cases"
      ]
    },
    {
      "id": "task-5",
      "title": "Implement run and document chunk adapters",
      "description": "Implement PostgreSQL outbound adapters for run records, bulk document chunk storage, embedding set resolution, and chunk embedding storage.",
      "status": "todo",
      "dependencies": [
        "task-2",
        "task-3"
      ],
      "acceptanceCriteria": [
        "Run adapter stores run status, agentTool, timestamps, raw run JSON, and artifactRefs JSON.",
        "Document chunk adapter supports bulk upsert by document relationship and chunkHash without storing vector values on document_chunks.",
        "Chunks without embedding are accepted and remain eligible for keyword search.",
        "EmbeddingSet adapter resolves or creates embedding sets by embeddingModel, embeddingDimension, embeddingVersion, and distanceMetric.",
        "ChunkEmbedding adapter stores vector values in chunk_embeddings by chunkId + embeddingSetId only when provided by the caller.",
        "New embedding models or versions can be stored as additional embedding sets and chunk_embeddings rows without overwriting existing chunk embeddings.",
        "Repeated writes for the same chunkId + embeddingSetId are idempotent when embeddingHash matches and return conflict when a different vector/hash is supplied without an explicit overwrite policy.",
        "Adapter rejects or clearly surfaces invalid relation references and source ID conflicts according to the port contract."
      ],
      "targetArea": "postgres adapter",
      "suggestedAgentPrompt": "Implement run record, document chunk, embedding set, and chunk embedding persistence adapters. Support bulk chunk writes, nullable externally supplied embeddings, chunkHash idempotency, chunkId + embeddingSetId idempotency, and JSON metadata/artifact refs.",
      "sourceSpecRefs": [
        "product.data_model_draft",
        "implementation.data_flow",
        "implementation.edge_cases"
      ]
    },
    {
      "id": "task-6",
      "title": "Implement write application use cases and transactions",
      "description": "Implement write-side application services for project, iteration, document snapshot, task graph, task, run, and chunk persistence with transaction boundaries.",
      "status": "todo",
      "dependencies": [
        "task-4",
        "task-5"
      ],
      "acceptanceCriteria": [
        "Use case implementations exist for project registration, iteration registration, document snapshot save, task graph save, task bulk save, run record save, and document chunk bulk save.",
        "Write use cases enforce content hash idempotency, snapshotVersion creation, source reference resolution, relationship validation, and chunkHash idempotency before calling outbound adapters.",
        "Run save handles run JSON and artifact refs in a single application transaction.",
        "Document chunk save coordinates chunk persistence, embedding set resolution, and chunk embedding persistence without generating embeddings.",